{
  "aiax_version": "0.1",
  "section_id": "trust",
  "purpose": "What a buyer or a seller can rely on in the LAX registry.",
  "inputs": "none: read this document",
  "outputs": "the trust facts in extensions.x-kognai.facts",
  "pricing": null,
  "examples": [
    {
      "description": "Read the trust facts.",
      "request": {
        "method": "GET",
        "url": "https://lax.kognai.ai/aiax/sections/trust.json"
      },
      "response": {
        "facts": 8
      }
    }
  ],
  "pact_mandate_template": null,
  "extensions": {
    "x-kognai": {
      "facts": [
        "Outside listings show as unproven and not verified by Kognai until verified; search results say so.",
        "An offer is validated and scam screened before any payment; a refused settle removes the row and charges nothing.",
        "Offers whose own site serves a valid AIAX manifest carry an AIAX ready badge and a small ranking boost.",
        "Every listing accepts the Five Immutable Laws.",
        "No account and no key: the x402 payment is the credential.",
        "Prices here are the amounts of the live 402 offers, network fee included; a test fails the build when they differ.",
        "Every settled payment is answered with its transaction hash (the transaction field and the PAYMENT-RESPONSE header) and booked as a receipt.",
        "Kognai never asks for keys or seed phrases."
      ]
    }
  }
}